kind,volumeInfo,searchInfo,saleInfo,etag,accessInfo,id,selfLink
books#volume,"{u'publisher': u'Equinox Publishing', u'language': u'en', u'publishedDate': u'2003', u'readingModes': {u'text': False, u'image': False}, u'previewLink': u'http://books.google.com/books?id=zrG2AAAAIAAJ&q=java&dq=java&hl=&cd=97&source=gbs_api', u'title': u'A cup of Java', u'printType': u'BOOK', u'canonicalVolumeLink': u'https://books.google.com/books/about/A_cup_of_Java.html?hl=&id=zrG2AAAAIAAJ', u'pageCount': 142, u'maturityRating': u'NOT_MATURE', u'contentVersion': u'preview-1.0.0', u'industryIdentifiers': [{u'identifier': u'STANFORD:36105122937621', u'type': u'OTHER'}], u'imageLinks': {u'smallThumbnail': u'http://books.google.com/books/content?id=zrG2AAAAIAAJ&printsec=frontcover&img=1&zoom=5&source=gbs_api', u'thumbnail': u'http://books.google.com/books/content?id=zrG2AAAAIAAJ&printsec=frontcover&img=1&zoom=1&source=gbs_api'}, u'authors': [u'Gabriella Teggia', u'Mark Hanusz'], u'ratingsCount': 1, u'allowAnonLogging': False, u'infoLink': u'http://books.google.com/books?id=zrG2AAAAIAAJ&dq=java&hl=&source=gbs_api', u'categories': [u'Social Science'], u'averageRating': 5.0}",,"{u'country': u'US', u'saleability': u'NOT_FOR_SALE', u'isEbook': False}",HwMHfwH5w9c,"{u'webReaderLink': u'http://play.google.com/books/reader?id=zrG2AAAAIAAJ&hl=&printsec=frontcover&output=reader&source=gbs_api', u'publicDomain': False, u'embeddable': False, u'country': u'US', u'textToSpeechPermission': u'ALLOWED', u'pdf': {u'isAvailable': False}, u'quoteSharingAllowed': False, u'viewability': u'NO_PAGES', u'epub': {u'isAvailable': False}, u'accessViewStatus': u'NONE'}",zrG2AAAAIAAJ,https://www.googleapis.com/books/v1/volumes/zrG2AAAAIAAJ
books#volume,"{u'publisher': u'Addison Wesley', u'description': u'With this book, Tim Budd looks at data structures by providing a solid foundation on the ADT, and uses the graphical elements found in Java when possible. The beginning chapters provide the foundation on which everything else will be built. These chapters define the essential concept of the abstract data type (ADT), and describe the tools used in the evaluation and analysis of data structures. The book moves on to provide a detailed description of the two most important fundamental data abstractions, the vector and the linked list, providing an explanation of some of the more common variations on these fundamental ideas. Next, the material considers data structures applicable to problems in which the order that values are added to a collection is important, followed by a consideration of the various different ways in which binary trees are used in the creation of data structures. The last few chapters consider a sequence of more advanced data structures. Most are constructed as adaptors built on top of earlier abstractions. Hash tables are introduced first as a technique for implementing simple collections, and later as a tool for developing efficient maps. Lastly, the graph data t', u'language': u'en', u'publishedDate': u'2001', u'readingModes': {u'text': False, u'image': False}, u'previewLink': u'http://books.google.com/books?id=Rq9QAAAAMAAJ&q=java&dq=java&hl=&cd=100&source=gbs_api', u'title': u'Classic Data Structures in Java', u'printType': u'BOOK', u'canonicalVolumeLink': u'https://books.google.com/books/about/Classic_Data_Structures_in_Java.html?hl=&id=Rq9QAAAAMAAJ', u'pageCount': 593, u'maturityRating': u'NOT_MATURE', u'contentVersion': u'0.1.1.0.preview.0', u'industryIdentifiers': [{u'identifier': u'0201700026', u'type': u'ISBN_10'}, {u'identifier': u'9780201700022', u'type': u'ISBN_13'}], u'imageLinks': {u'smallThumbnail': u'http://books.google.com/books/content?id=Rq9QAAAAMAAJ&printsec=frontcover&img=1&zoom=5&source=gbs_api', u'thumbnail': u'http://books.google.com/books/content?id=Rq9QAAAAMAAJ&printsec=frontcover&img=1&zoom=1&source=gbs_api'}, u'authors': [u'Timothy Budd'], u'ratingsCount': 1, u'allowAnonLogging': False, u'infoLink': u'http://books.google.com/books?id=Rq9QAAAAMAAJ&dq=java&hl=&source=gbs_api', u'categories': [u'Computers'], u'averageRating': 4.0}","{u'textSnippet': u'With this book, Tim Budd looks at data structures by providing a solid foundation on the ADT, and uses the graphical elements found in Java when possible.'}","{u'country': u'US', u'saleability': u'NOT_FOR_SALE', u'isEbook': False}",x4jEzA6+a1Q,"{u'webReaderLink': u'http://play.google.com/books/reader?id=Rq9QAAAAMAAJ&hl=&printsec=frontcover&output=reader&source=gbs_api', u'publicDomain': False, u'embeddable': False, u'country': u'US', u'textToSpeechPermission': u'ALLOWED', u'pdf': {u'isAvailable': False}, u'quoteSharingAllowed': False, u'viewability': u'NO_PAGES', u'epub': {u'isAvailable': False}, u'accessViewStatus': u'NONE'}",Rq9QAAAAMAAJ,https://www.googleapis.com/books/v1/volumes/Rq9QAAAAMAAJ
books#volume,"{u'publisher': u'CRC Press', u'description': u'Software engineering and computer science students need a resource that explains how to apply design patterns at the enterprise level, allowing them to design and implement systems of high stability and quality. Software Architecture Design Patterns in Java is a detailed explanation of how to apply design patterns and develop software architectures. It provides in-depth examples in Java, and guides students by detailing when, why, and how to use specific patterns. This textbook presents 42 design patterns, including 23 GoF patterns. Categories include: Basic, Creational, Collectional, Structural, Behavioral, and Concurrency, with multiple examples for each. The discussion of each pattern includes an example implemented in Java. The source code for all examples is found on a companion Web site. The author explains the content so that it is easy to understand, and each pattern discussion includes Practice Questions to aid instructors. The textbook concludes with a case study that pulls several patterns together to demonstrate how patterns are not applied in isolation, but collaborate within domains to solve complicated problems.', u'language': u'en', u'publishedDate': u'2004-04-27', u'readingModes': {u'text': True, u'image': True}, u'previewLink': u'http://books.google.com/books?id=FqfKFl4Bm7UC&printsec=frontcover&dq=java&hl=&cd=102&source=gbs_api', u'infoLink': u'https://play.google.com/store/books/details?id=FqfKFl4Bm7UC&source=gbs_api', u'title': u'Software Architecture Design Patterns in Java', u'printType': u'BOOK', u'canonicalVolumeLink': u'https://market.android.com/details?id=book-FqfKFl4Bm7UC', u'pageCount': 520, u'maturityRating': u'NOT_MATURE', u'contentVersion': u'0.1.3.0.preview.3', u'industryIdentifiers': [{u'identifier': u'0203496213', u'type': u'ISBN_10'}, {u'identifier': u'9780203496213', u'type': u'ISBN_13'}], u'imageLinks': {u'smallThumbnail': u'http://books.google.com/books/content?id=FqfKFl4Bm7UC&printsec=frontcover&img=1&zoom=5&edge=curl&source=gbs_api', u'thumbnail': u'http://books.google.com/books/content?id=FqfKFl4Bm7UC&printsec=frontcover&img=1&zoom=1&edge=curl&source=gbs_api'}, u'authors': [u'Partha Kuchana'], u'ratingsCount': 1, u'allowAnonLogging': False, u'panelizationSummary': {u'containsEpubBubbles': False, u'containsImageBubbles': False}, u'categories': [u'Computers'], u'averageRating': 4.0}",{u'textSnippet': u'Software Architecture Design Patterns in Java is a detailed explanation of how to apply design patterns and develop software architectures.'},"{u'country': u'US', u'retailPrice': {u'amount': 69.79, u'currencyCode': u'USD'}, u'isEbook': True, u'offers': [{u'retailPrice': {u'currencyCode': u'USD', u'amountInMicros': 69790000.0}, u'giftable': True, u'listPrice': {u'currencyCode': u'USD', u'amountInMicros': 94950000.0}, u'finskyOfferType': 1}], u'saleability': u'FOR_SALE', u'buyLink': u'https://play.google.com/store/books/details?id=FqfKFl4Bm7UC&rdid=book-FqfKFl4Bm7UC&rdot=1&source=gbs_api', u'listPrice': {u'amount': 94.95, u'currencyCode': u'USD'}}",oTXTvkxpFBU,"{u'webReaderLink': u'http://play.google.com/books/reader?id=FqfKFl4Bm7UC&hl=&printsec=frontcover&output=reader&source=gbs_api', u'publicDomain': False, u'embeddable': True, u'country': u'US', u'textToSpeechPermission': u'ALLOWED', u'pdf': {u'isAvailable': True, u'acsTokenLink': u'http://books.google.com/books/download/Software_Architecture_Design_Patterns_in-sample-pdf.acsm?id=FqfKFl4Bm7UC&format=pdf&output=acs4_fulfillment_token&dl_type=sample&source=gbs_api'}, u'quoteSharingAllowed': False, u'viewability': u'PARTIAL', u'epub': {u'isAvailable': True, u'acsTokenLink': u'http://books.google.com/books/download/Software_Architecture_Design_Patterns_in-sample-epub.acsm?id=FqfKFl4Bm7UC&format=epub&output=acs4_fulfillment_token&dl_type=sample&source=gbs_api'}, u'accessViewStatus': u'SAMPLE'}",FqfKFl4Bm7UC,https://www.googleapis.com/books/v1/volumes/FqfKFl4Bm7UC
books#volume,"{u'publisher': u'Prentice Hall', u'description': u""This new book provides a concise and engaging introduction to Java and object-oriented programming with an abundance of original examples, use of Unified Modeling Language throughout, and coverage of the new Java 1.5. Addressing critical concepts up front, the book's five-part structure covers object-oriented programming, linear structures, algorithms, trees and collections, and advanced topics.KEY FEATURES: Data Structures and Algorithms in Java takes a practical approach to real-world programming and introduces readers to the process of crafting programs by working through the development of projects, often providing multiple versions of the code and consideration for alternate designs. The book features the extensive use of games as examples; a gradual development of classes analogous to the Java Collections Framework; complete, working code in the book and online; and strong pedagogy including extended examples in most chapters along with exercises, problems and projects.For readers and professionals with a familiarity with the basic control structures of Java or C and a precalculus level of mathematics who want to expand their knowledge to Java data structures and algorithms. Ideal for a second undergraduate course in computer science."", u'language': u'en', u'publishedDate': u'2006', u'readingModes': {u'text': True, u'image': False}, u'previewLink': u'http://books.google.com/books?id=iiLCLRTIV8AC&q=java&dq=java&hl=&cd=114&source=gbs_api', u'title': u'Data Structures and Algorithms in Java', u'printType': u'BOOK', u'canonicalVolumeLink': u'https://books.google.com/books/about/Data_Structures_and_Algorithms_in_Java.html?hl=&id=iiLCLRTIV8AC', u'pageCount': 568, u'maturityRating': u'NOT_MATURE', u'contentVersion': u'0.0.2.0.preview.2', u'industryIdentifiers': [{u'identifier': u'9780131469143', u'type': u'ISBN_13'}, {u'identifier': u'0131469142', u'type': u'ISBN_10'}], u'imageLinks': {u'smallThumbnail': u'http://books.google.com/books/content?id=iiLCLRTIV8AC&printsec=frontcover&img=1&zoom=5&source=gbs_api', u'thumbnail': u'http://books.google.com/books/content?id=iiLCLRTIV8AC&printsec=frontcover&img=1&zoom=1&source=gbs_api'}, u'authors': [u'Peter Drake'], u'ratingsCount': 1, u'allowAnonLogging': False, u'infoLink': u'http://books.google.com/books?id=iiLCLRTIV8AC&dq=java&hl=&source=gbs_api', u'categories': [u'Computers'], u'averageRating': 5.0}","{u'textSnippet': u'This new book provides a concise and engaging introduction to Java and object-oriented programming with an abundance of original examples, use of Unified Modeling Language throughout, and coverage of the new Java 1.5.'}","{u'country': u'US', u'saleability': u'NOT_FOR_SALE', u'isEbook': False}",gOoEab/h7j8,"{u'webReaderLink': u'http://play.google.com/books/reader?id=iiLCLRTIV8AC&hl=&printsec=frontcover&output=reader&source=gbs_api', u'publicDomain': False, u'embeddable': False, u'country': u'US', u'textToSpeechPermission': u'ALLOWED_FOR_ACCESSIBILITY', u'pdf': {u'isAvailable': False}, u'quoteSharingAllowed': False, u'viewability': u'NO_PAGES', u'epub': {u'isAvailable': False}, u'accessViewStatus': u'NONE'}",iiLCLRTIV8AC,https://www.googleapis.com/books/v1/volumes/iiLCLRTIV8AC
books#volume,"{u'subtitle': u'Java, the Dutch, and the Cultivation System', u'pageCount': 266, u'panelizationSummary': {u'containsEpubBubbles': False, u'containsImageBubbles': False}, u'previewLink': u'http://books.google.com/books?id=0gURzbnXUv8C&printsec=frontcover&dq=java&hl=&cd=119&source=gbs_api', u'contentVersion': u'0.0.1.0.preview.1', u'industryIdentifiers': [{u'identifier': u'0877277079', u'type': u'ISBN_10'}, {u'identifier': u'9780877277071', u'type': u'ISBN_13'}], u'canonicalVolumeLink': u'https://books.google.com/books/about/The_Politics_of_Colonial_Exploitation.html?hl=&id=0gURzbnXUv8C', u'description': u'Studies on Southeast Asia 8 The development of the Cultivation System from the years 1840 to 1860 is the focus of this work by the Dutch scholar Cornelis Fasseur. The author presents a general overview of Dutch po y and decision-making, and considers how these policies influenced the evolution of the Cultivation System and how the system itself altered Dutch views of governance in Java.', u'publishedDate': u'1992-01-01', u'imageLinks': {u'smallThumbnail': u'http://books.google.com/books/content?id=0gURzbnXUv8C&printsec=frontcover&img=1&zoom=5&edge=curl&source=gbs_api', u'thumbnail': u'http://books.google.com/books/content?id=0gURzbnXUv8C&printsec=frontcover&img=1&zoom=1&edge=curl&source=gbs_api'}, u'authors': [u'C. Fasseur'], u'categories': [u'History'], u'publisher': u'SEAP Publications', u'language': u'en', u'readingModes': {u'text': False, u'image': True}, u'allowAnonLogging': False, u'title': u'The Politics of Colonial Exploitation', u'printType': u'BOOK', u'maturityRating': u'NOT_MATURE', u'averageRating': 5.0, u'infoLink': u'http://books.google.com/books?id=0gURzbnXUv8C&dq=java&hl=&source=gbs_api', u'ratingsCount': 1}",{u'textSnippet': u'Studies on Southeast Asia 8 The development of the Cultivation System from the years 1840 to 1860 is the focus of this work by the Dutch scholar Cornelis Fasseur.'},"{u'country': u'US', u'saleability': u'NOT_FOR_SALE', u'isEbook': False}",fGSTa0l4E0s,"{u'webReaderLink': u'http://play.google.com/books/reader?id=0gURzbnXUv8C&hl=&printsec=frontcover&output=reader&source=gbs_api', u'publicDomain': False, u'embeddable': True, u'country': u'US', u'textToSpeechPermission': u'ALLOWED', u'pdf': {u'isAvailable': False}, u'quoteSharingAllowed': False, u'viewability': u'PARTIAL', u'epub': {u'isAvailable': False}, u'accessViewStatus': u'SAMPLE'}",0gURzbnXUv8C,https://www.googleapis.com/books/v1/volumes/0gURzbnXUv8C
books#volume,"{u'publisher': u'In Easy Steps', u'description': u'.""..updated for Java 7""--P. [4] of cover.', u'language': u'en', u'publishedDate': u'2011', u'readingModes': {u'text': False, u'image': False}, u'previewLink': u'http://books.google.com/books?id=1yiWOofHWgEC&dq=java&hl=&cd=134&source=gbs_api', u'title': u'Java in Easy Steps', u'printType': u'BOOK', u'canonicalVolumeLink': u'https://books.google.com/books/about/Java_in_Easy_Steps.html?hl=&id=1yiWOofHWgEC', u'pageCount': 192, u'maturityRating': u'NOT_MATURE', u'contentVersion': u'1.1.1.0.preview.0', u'industryIdentifiers': [{u'identifier': u'9781840784435', u'type': u'ISBN_13'}, {u'identifier': u'1840784431', u'type': u'ISBN_10'}], u'imageLinks': {u'smallThumbnail': u'http://books.google.com/books/content?id=1yiWOofHWgEC&printsec=frontcover&img=1&zoom=5&source=gbs_api', u'thumbnail': u'http://books.google.com/books/content?id=1yiWOofHWgEC&printsec=frontcover&img=1&zoom=1&source=gbs_api'}, u'authors': [u'Mike McGrath'], u'ratingsCount': 1, u'allowAnonLogging': False, u'infoLink': u'http://books.google.com/books?id=1yiWOofHWgEC&dq=java&hl=&source=gbs_api', u'categories': [u'Computers'], u'averageRating': 5.0}",{u'textSnippet': u'.&quot;..updated for Java 7&quot;--P. [4] of cover.'},"{u'country': u'US', u'saleability': u'NOT_FOR_SALE', u'isEbook': False}",+lqeM3TSWlI,"{u'webReaderLink': u'http://play.google.com/books/reader?id=1yiWOofHWgEC&hl=&printsec=frontcover&output=reader&source=gbs_api', u'publicDomain': False, u'embeddable': False, u'country': u'US', u'textToSpeechPermission': u'ALLOWED', u'pdf': {u'isAvailable': False}, u'quoteSharingAllowed': False, u'viewability': u'NO_PAGES', u'epub': {u'isAvailable': False}, u'accessViewStatus': u'NONE'}",1yiWOofHWgEC,https://www.googleapis.com/books/v1/volumes/1yiWOofHWgEC
books#volume,"{u'publisher': u'McGraw Hill Professional', u'description': u""The Definitive Java Programming Guide In Java: The Complete Reference, Eighth Edition, bestselling programming author Herb Schildt shows you everything you need to develop, compile, debug, and run Java programs. Updated for Java Platform, Standard Edition 7 (Java SE 7), this comprehensive volume covers the entire Java language, including its syntax, keywords, and fundamental programming principles. You'll also find information on key elements of the Java API library. JavaBeans, servlets, applets, and Swing are examined and real-world examples demonstrate Java in action. In addition, new Java SE 7 features such as try-with-resources, strings in switch, type inference with the diamond operator, NIO.2, and the Fork/Join Framework are discussed in detail. Coverage includes: Data types and operators Control statements Classes and objects Constructors and methods Method overloading and overriding Interfaces and packages Inheritance Exception handling Generics Autoboxing Enumerations Annotations The try-with-resources statement Varargs Multithreading The I/O classes Networking The Collections Framework Applets and servlets JavaBeans AWT and Swing The Concurrent API Much, much more"", u'language': u'en', u'publishedDate': u'2011-02-07', u'readingModes': {u'text': True, u'image': True}, u'previewLink': u'http://books.google.com/books?id=NEa5P9rq6RAC&printsec=frontcover&dq=java&hl=&cd=136&source=gbs_api', u'infoLink': u'https://play.google.com/store/books/details?id=NEa5P9rq6RAC&source=gbs_api', u'title': u'Java The Complete Reference, 8th Edition', u'printType': u'BOOK', u'canonicalVolumeLink': u'https://market.android.com/details?id=book-NEa5P9rq6RAC', u'pageCount': 1000, u'maturityRating': u'NOT_MATURE', u'contentVersion': u'4.12.8.0.preview.3', u'industryIdentifiers': [{u'identifier': u'9780071606318', u'type': u'ISBN_13'}, {u'identifier': u'0071606319', u'type': u'ISBN_10'}], u'imageLinks': {u'smallThumbnail': u'http://books.google.com/books/content?id=NEa5P9rq6RAC&printsec=frontcover&img=1&zoom=5&edge=curl&source=gbs_api', u'thumbnail': u'http://books.google.com/books/content?id=NEa5P9rq6RAC&printsec=frontcover&img=1&zoom=1&edge=curl&source=gbs_api'}, u'authors': [u'Herbert Schildt'], u'ratingsCount': 1, u'allowAnonLogging': True, u'panelizationSummary': {u'containsEpubBubbles': False, u'containsImageBubbles': False}, u'categories': [u'Computers'], u'averageRating': 5.0}","{u'textSnippet': u'Updated for Java Platform, Standard Edition 7 (Java SE 7), this comprehensive volume covers the entire Java language, including its syntax, keywords, and fundamental programming principles.'}","{u'country': u'US', u'retailPrice': {u'amount': 50.4, u'currencyCode': u'USD'}, u'isEbook': True, u'offers': [{u'retailPrice': {u'currencyCode': u'USD', u'amountInMicros': 50400000.0}, u'giftable': True, u'listPrice': {u'currencyCode': u'USD', u'amountInMicros': 63000000.0}, u'finskyOfferType': 1}], u'saleability': u'FOR_SALE', u'buyLink': u'https://play.google.com/store/books/details?id=NEa5P9rq6RAC&rdid=book-NEa5P9rq6RAC&rdot=1&source=gbs_api', u'listPrice': {u'amount': 63.0, u'currencyCode': u'USD'}}",CcUq2ECWd0Q,"{u'webReaderLink': u'http://play.google.com/books/reader?id=NEa5P9rq6RAC&hl=&printsec=frontcover&output=reader&source=gbs_api', u'publicDomain': False, u'embeddable': True, u'country': u'US', u'textToSpeechPermission': u'ALLOWED_FOR_ACCESSIBILITY', u'pdf': {u'isAvailable': True, u'acsTokenLink': u'http://books.google.com/books/download/Java_The_Complete_Reference_8th_Edition-sample-pdf.acsm?id=NEa5P9rq6RAC&format=pdf&output=acs4_fulfillment_token&dl_type=sample&source=gbs_api'}, u'quoteSharingAllowed': False, u'viewability': u'PARTIAL', u'epub': {u'isAvailable': True, u'acsTokenLink': u'http://books.google.com/books/download/Java_The_Complete_Reference_8th_Edition-sample-epub.acsm?id=NEa5P9rq6RAC&format=epub&output=acs4_fulfillment_token&dl_type=sample&source=gbs_api'}, u'accessViewStatus': u'SAMPLE'}",NEa5P9rq6RAC,https://www.googleapis.com/books/v1/volumes/NEa5P9rq6RAC
books#volume,"{u'subtitle': u'Modern Data Access for Enterprise Java', u'pageCount': 316, u'panelizationSummary': {u'containsEpubBubbles': False, u'containsImageBubbles': False}, u'previewLink': u'http://books.google.com/books?id=DeTO4xbC-eoC&printsec=frontcover&dq=java&hl=&cd=137&source=gbs_api', u'contentVersion': u'3.4.4.0.preview.3', u'industryIdentifiers': [{u'identifier': u'9781449331887', u'type': u'ISBN_13'}, {u'identifier': u'1449331882', u'type': u'ISBN_10'}], u'canonicalVolumeLink': u'https://market.android.com/details?id=book-DeTO4xbC-eoC', u'description': u'You can choose several data access frameworks when building Java enterprise applications that work with relational databases. But what about big data? This hands-on introduction shows you how Spring Data makes it relatively easy to build applications across a wide range of new data access technologies such as NoSQL and Hadoop. Through several sample projects, you\u2019ll learn how Spring Data provides a consistent programming model that retains NoSQL-specific features and capabilities, and helps you develop Hadoop applications across a wide range of use-cases such as data analysis, event stream processing, and workflow. You\u2019ll also discover the features Spring Data adds to Spring\u2019s existing JPA and JDBC support for writing RDBMS-based data access layers. Learn about Spring\u2019s template helper classes to simplify the use ofdatabase-specific functionality Explore Spring Data\u2019s repository abstraction and advanced query functionality Use Spring Data with Redis (key/value store), HBase(column-family), MongoDB (document database), and Neo4j (graph database) Discover the GemFire distributed data grid solution Export Spring Data JPA-managed entities to the Web as RESTful web services Simplify the development of HBase applications, using a lightweight object-mapping framework Build example big-data pipelines with Spring Batch and Spring Integration', u'publishedDate': u'2012-10-12', u'imageLinks': {u'smallThumbnail': u'http://books.google.com/books/content?id=DeTO4xbC-eoC&printsec=frontcover&img=1&zoom=5&edge=curl&source=gbs_api', u'thumbnail': u'http://books.google.com/books/content?id=DeTO4xbC-eoC&printsec=frontcover&img=1&zoom=1&edge=curl&source=gbs_api'}, u'authors': [u'Mark Pollack', u'Oliver Gierke', u'Thomas Risberg', u'Jon Brisbin', u'Michael Hunger'], u'categories': [u'Computers'], u'publisher': u'""O\'Reilly Media, Inc.""', u'language': u'en', u'readingModes': {u'text': True, u'image': True}, u'allowAnonLogging': True, u'title': u'Spring Data', u'printType': u'BOOK', u'maturityRating': u'NOT_MATURE', u'averageRating': 3.0, u'infoLink': u'https://play.google.com/store/books/details?id=DeTO4xbC-eoC&source=gbs_api', u'ratingsCount': 1}","{u'textSnippet': u'Learn about Spring\u2019s template helper classes to simplify the use ofdatabase-specific functionality Explore Spring Data\u2019s repository abstraction and advanced query functionality Use Spring Data with Redis (key/value store), HBase(column ...'}","{u'country': u'US', u'retailPrice': {u'amount': 18.35, u'currencyCode': u'USD'}, u'isEbook': True, u'offers': [{u'retailPrice': {u'currencyCode': u'USD', u'amountInMicros': 18350000.0}, u'giftable': True, u'listPrice': {u'currencyCode': u'USD', u'amountInMicros': 33990000.0}, u'finskyOfferType': 1}, {u'rentalDuration': {u'count': 90.0, u'unit': u'DAY'}, u'retailPrice': {u'currencyCode': u'USD', u'amountInMicros': 17000000.0}, u'listPrice': {u'currencyCode': u'USD', u'amountInMicros': 17000000.0}, u'finskyOfferType': 3}], u'saleability': u'FOR_SALE_AND_RENTAL', u'buyLink': u'https://play.google.com/store/books/details?id=DeTO4xbC-eoC&rdid=book-DeTO4xbC-eoC&rdot=1&source=gbs_api', u'listPrice': {u'amount': 33.99, u'currencyCode': u'USD'}}",XLyX9NbHLd8,"{u'webReaderLink': u'http://play.google.com/books/reader?id=DeTO4xbC-eoC&hl=&printsec=frontcover&output=reader&source=gbs_api', u'publicDomain': False, u'embeddable': True, u'country': u'US', u'textToSpeechPermission': u'ALLOWED', u'pdf': {u'isAvailable': True}, u'quoteSharingAllowed': False, u'viewability': u'PARTIAL', u'epub': {u'isAvailable': True}, u'accessViewStatus': u'SAMPLE'}",DeTO4xbC-eoC,https://www.googleapis.com/books/v1/volumes/DeTO4xbC-eoC
