kind,volumeInfo,searchInfo,saleInfo,etag,accessInfo,id,selfLink
books#volume,"{u'publisher': u'SAP PRESS', u'description': u""This updated and completely revised second edition of Inside Web Dynpro for Java covers everything you need to know to leverage the full power of Web Dynpro for Java - taking you well beyond the standard drag and drop functionality. For this second edition, sections on the migration of legacy applications have been added, as well as another entirely new section devoted to integration topics. In addition, you'll find key details on the portal, Adobe Document Services, Business Graphics Server, MS Office, and mobile applications, and much more. General architecture Coding principles in Web Dynpro Dynamic UI generation The Common Model Interface The Adaptive RFC layer Web Dynpro phase model Class and Interface Reference"", u'language': u'en', u'publishedDate': u'2007', u'readingModes': {u'text': False, u'image': False}, u'previewLink': u'http://books.google.com/books?id=HXDjPAAACAAJ&dq=java&hl=&cd=192&source=gbs_api', u'title': u'Inside Web Dynpro for Java', u'printType': u'BOOK', u'canonicalVolumeLink': u'https://books.google.com/books/about/Inside_Web_Dynpro_for_Java.html?hl=&id=HXDjPAAACAAJ', u'pageCount': 538, u'maturityRating': u'NOT_MATURE', u'contentVersion': u'preview-1.0.0', u'industryIdentifiers': [{u'identifier': u'1592290922', u'type': u'ISBN_10'}, {u'identifier': u'9781592290925', u'type': u'ISBN_13'}], u'imageLinks': {u'smallThumbnail': u'http://books.google.com/books/content?id=HXDjPAAACAAJ&printsec=frontcover&img=1&zoom=5&source=gbs_api', u'thumbnail': u'http://books.google.com/books/content?id=HXDjPAAACAAJ&printsec=frontcover&img=1&zoom=1&source=gbs_api'}, u'authors': [u'Chris Whealy'], u'ratingsCount': 1, u'allowAnonLogging': False, u'infoLink': u'http://books.google.com/books?id=HXDjPAAACAAJ&dq=java&hl=&source=gbs_api', u'categories': [u'Java (Computer program language)'], u'averageRating': 1.0}","{u'textSnippet': u'For this second edition, sections on the migration of legacy applications have been added, as well as another entirely new section devoted to integration topics.'}","{u'country': u'US', u'saleability': u'NOT_FOR_SALE', u'isEbook': False}",xORWmiX+JR0,"{u'webReaderLink': u'http://play.google.com/books/reader?id=HXDjPAAACAAJ&hl=&printsec=frontcover&output=reader&source=gbs_api', u'publicDomain': False, u'embeddable': False, u'country': u'US', u'textToSpeechPermission': u'ALLOWED', u'pdf': {u'isAvailable': False}, u'quoteSharingAllowed': False, u'viewability': u'NO_PAGES', u'epub': {u'isAvailable': False}, u'accessViewStatus': u'NONE'}",HXDjPAAACAAJ,https://www.googleapis.com/books/v1/volumes/HXDjPAAACAAJ
books#volume,"{u'publisher': u'Addison-Wesley', u'subtitle': u'Design Styles and Idioms for Effective Java', u'description': u'Are you a developer or designer using Java? Are you looking to do more than build applets for the web? Do you find yourself constantly coming up against the same recurring design problems with your Java code? Java in Practice presents a set of design principles that provide elegant solutions to commonly encountered Java programming problems. Nigel Warren and Philip Bishop discuss the effect of the use of Java within design and have distilled their own extensive experience into a number of rules, design principles and tips which will help you to write better and quicker Java. RULES: defined in the Java Language Specification, these must be adhered to PRINCIPLES: design principles that will help you write better Java across the board TIPS: guide your thinking and approach to solutions Java In Practice: uses code examples to illustrate both good and poor programming style is packed full of coding examples with design notation in UML starts with simple code examples, then builds in depth and complexity throughout the book has a practical how-to approach that will help you create new products and software solutions. About the Authors: Nigel Warren is Chief Technical Architect at Digital', u'language': u'en', u'publishedDate': u'1999-01', u'readingModes': {u'text': False, u'image': False}, u'previewLink': u'http://books.google.com/books?id=g7VQAAAAMAAJ&q=java&dq=java&hl=&cd=197&source=gbs_api', u'title': u'Java in Practice', u'printType': u'BOOK', u'canonicalVolumeLink': u'https://books.google.com/books/about/Java_in_Practice.html?hl=&id=g7VQAAAAMAAJ', u'pageCount': 209, u'maturityRating': u'NOT_MATURE', u'contentVersion': u'0.0.1.0.preview.0', u'industryIdentifiers': [{u'identifier': u'0201360659', u'type': u'ISBN_10'}, {u'identifier': u'9780201360653', u'type': u'ISBN_13'}], u'imageLinks': {u'smallThumbnail': u'http://books.google.com/books/content?id=g7VQAAAAMAAJ&printsec=frontcover&img=1&zoom=5&source=gbs_api', u'thumbnail': u'http://books.google.com/books/content?id=g7VQAAAAMAAJ&printsec=frontcover&img=1&zoom=1&source=gbs_api'}, u'authors': [u'Nigel Warren'], u'ratingsCount': 1, u'allowAnonLogging': False, u'infoLink': u'http://books.google.com/books?id=g7VQAAAAMAAJ&dq=java&hl=&source=gbs_api', u'categories': [u'Computers'], u'averageRating': 5.0}","{u'textSnippet': u'RULES: defined in the Java Language Specification, these must be adhered to PRINCIPLES: design principles that will help you write better Java across the board TIPS: guide your thinking and approach to solutions Java In Practice: uses code ...'}","{u'country': u'US', u'saleability': u'NOT_FOR_SALE', u'isEbook': False}",lnsbWRHqfV8,"{u'webReaderLink': u'http://play.google.com/books/reader?id=g7VQAAAAMAAJ&hl=&printsec=frontcover&output=reader&source=gbs_api', u'publicDomain': False, u'embeddable': False, u'country': u'US', u'textToSpeechPermission': u'ALLOWED', u'pdf': {u'isAvailable': False}, u'quoteSharingAllowed': False, u'viewability': u'NO_PAGES', u'epub': {u'isAvailable': False}, u'accessViewStatus': u'NONE'}",g7VQAAAAMAAJ,https://www.googleapis.com/books/v1/volumes/g7VQAAAAMAAJ
books#volume,"{u'panelizationSummary': {u'containsEpubBubbles': False, u'containsImageBubbles': False}, u'language': u'en', u'publishedDate': u'1830', u'readingModes': {u'text': True, u'image': True}, u'previewLink': u'http://books.google.com/books?id=gJEC2q7DzpQC&printsec=frontcover&dq=java&hl=&cd=5&source=gbs_api', u'pageCount': 868, u'printType': u'BOOK', u'canonicalVolumeLink': u'https://market.android.com/details?id=book-gJEC2q7DzpQC', u'maturityRating': u'NOT_MATURE', u'contentVersion': u'0.2.3.0.full.3', u'industryIdentifiers': [{u'identifier': u'HARVARD:32044021066998', u'type': u'OTHER'}], u'imageLinks': {u'smallThumbnail': u'http://books.google.com/books/content?id=gJEC2q7DzpQC&printsec=frontcover&img=1&zoom=5&edge=curl&source=gbs_api', u'thumbnail': u'http://books.google.com/books/content?id=gJEC2q7DzpQC&printsec=frontcover&img=1&zoom=1&edge=curl&source=gbs_api'}, u'authors': [u'Sir Thomas Stamford Raffles'], u'title': u'The History of Java', u'ratingsCount': 2, u'allowAnonLogging': False, u'infoLink': u'https://play.google.com/store/books/details?id=gJEC2q7DzpQC&source=gbs_api', u'categories': [u'Java (Indonesia)'], u'averageRating': 5.0}",,"{u'country': u'US', u'buyLink': u'https://play.google.com/store/books/details?id=gJEC2q7DzpQC&rdid=book-gJEC2q7DzpQC&rdot=1&source=gbs_api', u'saleability': u'FREE', u'isEbook': True}",cL4sF7ZmoRw,"{u'webReaderLink': u'http://play.google.com/books/reader?id=gJEC2q7DzpQC&hl=&printsec=frontcover&source=gbs_api', u'publicDomain': True, u'embeddable': True, u'country': u'US', u'textToSpeechPermission': u'ALLOWED', u'pdf': {u'isAvailable': True, u'downloadLink': u'http://books.google.com/books/download/The_History_of_Java.pdf?id=gJEC2q7DzpQC&hl=&output=pdf&sig=ACfU3U1FeZs0WwTQ2Z_X_IqhvzCelUN01A&source=gbs_api'}, u'quoteSharingAllowed': False, u'viewability': u'ALL_PAGES', u'epub': {u'isAvailable': True, u'downloadLink': u'http://books.google.com/books/download/The_History_of_Java.epub?id=gJEC2q7DzpQC&hl=&output=epub&source=gbs_api'}, u'accessViewStatus': u'FULL_PUBLIC_DOMAIN'}",gJEC2q7DzpQC,https://www.googleapis.com/books/v1/volumes/gJEC2q7DzpQC
books#volume,"{u'publisher': u'Tata McGraw-Hill Education', u'subtitle': u'Essentials and Applications', u'language': u'en', u'publishedDate': u'2009', u'readingModes': {u'text': False, u'image': True}, u'previewLink': u'http://books.google.com/books?id=rXGMFYXFDwMC&printsec=frontcover&dq=java&hl=&cd=10&source=gbs_api', u'title': u'Object-oriented Programming with Java', u'printType': u'BOOK', u'canonicalVolumeLink': u'https://books.google.com/books/about/Object_oriented_Programming_with_Java.html?hl=&id=rXGMFYXFDwMC', u'pageCount': 649, u'maturityRating': u'NOT_MATURE', u'contentVersion': u'0.0.1.0.preview.1', u'industryIdentifiers': [{u'identifier': u'0070669082', u'type': u'ISBN_10'}, {u'identifier': u'9780070669086', u'type': u'ISBN_13'}], u'imageLinks': {u'smallThumbnail': u'http://books.google.com/books/content?id=rXGMFYXFDwMC&printsec=frontcover&img=1&zoom=5&edge=curl&source=gbs_api', u'thumbnail': u'http://books.google.com/books/content?id=rXGMFYXFDwMC&printsec=frontcover&img=1&zoom=1&edge=curl&source=gbs_api'}, u'authors': [u'Buyya'], u'ratingsCount': 2, u'allowAnonLogging': False, u'infoLink': u'http://books.google.com/books?id=rXGMFYXFDwMC&dq=java&hl=&source=gbs_api', u'categories': [u'Java (Computer program language)'], u'averageRating': 5.0}",{u'textSnippet': u'This book covers fundamentals of Object Oriented Programming with Java at both basic and advanced levels.'},"{u'country': u'US', u'saleability': u'NOT_FOR_SALE', u'isEbook': False}",J3uW7srm7vI,"{u'webReaderLink': u'http://play.google.com/books/reader?id=rXGMFYXFDwMC&hl=&printsec=frontcover&source=gbs_api', u'publicDomain': False, u'embeddable': True, u'country': u'US', u'textToSpeechPermission': u'ALLOWED', u'pdf': {u'isAvailable': False}, u'quoteSharingAllowed': False, u'viewability': u'PARTIAL', u'epub': {u'isAvailable': False}, u'accessViewStatus': u'SAMPLE'}",rXGMFYXFDwMC,https://www.googleapis.com/books/v1/volumes/rXGMFYXFDwMC
books#volume,"{u'subtitle': u'Practical Guide for Programmers', u'pageCount': 192, u'panelizationSummary': {u'containsEpubBubbles': False, u'containsImageBubbles': False}, u'previewLink': u'http://books.google.com/books?id=lfHo7uMk7r4C&printsec=frontcover&dq=java&hl=&cd=15&source=gbs_api', u'contentVersion': u'1.2.4.0.preview.3', u'industryIdentifiers': [{u'identifier': u'0080568785', u'type': u'ISBN_10'}, {u'identifier': u'9780080568782', u'type': u'ISBN_13'}], u'canonicalVolumeLink': u'https://market.android.com/details?id=book-lfHo7uMk7r4C', u'description': u'The networking capabilities of the Java platform have been extended considerably since the first edition of the book. This new edition covers version 1.5-1.7, the most current iterations, as well as making the following improvements: The API (application programming interface) reference sections in each chapter, which describe the relevant parts of each class, have been replaced with (i) a summary section that lists the classes and methods used in the code, and (ii) a ""gotchas"" section that mentions nonobvious or poorly-documented aspects of the objects. In addition, the book covers several new classes and capabilities introduced in the last few revisions of the Java platform. New abstractions to be covered include NetworkInterface, InterfaceAddress, Inet4/6Address, SocketAddress/InetSocketAddress, Executor, and others; extended access to low-level network information; support for IPv6; more complete access to socket options; and scalable I/O. The example code is also modified to take advantage of new language features such as annotations, enumerations, as well as generics and implicit iterators where appropriate. Most Internet applications use sockets to implement network communication protocols. This book\'s focused, tutorial-based approach helps the reader master the tasks and techniques essential to virtually all client-server projects using sockets in Java. Chapter 1 provides a general overview of networking concepts to allow readers to synchronize the concepts with terminology. Chapter 2 introduces the mechanics of simple clients and servers. Chapter 3 covers basic message construction and parsing. Chapter 4 then deals with techniques used to build more robust clients and servers. Chapter 5 (NEW) introduces the scalable interface facilities which were introduced in Java 1.5, including the buffer and channel abstractions. Chapter 6 discusses the relationship between the programming constructs and the underlying protocol implementations in more detail. Programming concepts are introduced through simple program examples accompanied by line-by-line code commentary that describes the purpose of every part of the program. No other resource presents so concisely or so effectively the material necessary to get up and running with Java sockets programming. Focused, tutorial-based instruction in key sockets programming techniques allows reader to quickly come up to speed on Java applications. Concise and up-to-date coverage of the most recent platform (1.7) for Java applications in networking technology.', u'publishedDate': u'2011-08-29', u'imageLinks': {u'smallThumbnail': u'http://books.google.com/books/content?id=lfHo7uMk7r4C&printsec=frontcover&img=1&zoom=5&edge=curl&source=gbs_api', u'thumbnail': u'http://books.google.com/books/content?id=lfHo7uMk7r4C&printsec=frontcover&img=1&zoom=1&edge=curl&source=gbs_api'}, u'authors': [u'Kenneth L. Calvert', u'Michael J. Donahoo'], u'categories': [u'Computers'], u'publisher': u'Morgan Kaufmann', u'language': u'en', u'readingModes': {u'text': True, u'image': True}, u'allowAnonLogging': True, u'title': u'TCP/IP Sockets in Java', u'printType': u'BOOK', u'maturityRating': u'NOT_MATURE', u'averageRating': 4.0, u'infoLink': u'https://play.google.com/store/books/details?id=lfHo7uMk7r4C&source=gbs_api', u'ratingsCount': 2}","{u'textSnippet': u'This book&#39;s focused, tutorial-based approach helps the reader master the tasks and techniques essential to virtually all client-server projects using sockets in Java.'}","{u'country': u'US', u'retailPrice': {u'amount': 15.63, u'currencyCode': u'USD'}, u'isEbook': True, u'offers': [{u'retailPrice': {u'currencyCode': u'USD', u'amountInMicros': 15630000.0}, u'giftable': True, u'listPrice': {u'currencyCode': u'USD', u'amountInMicros': 28950000.0}, u'finskyOfferType': 1}, {u'rentalDuration': {u'count': 90.0, u'unit': u'DAY'}, u'retailPrice': {u'currencyCode': u'USD', u'amountInMicros': 14650000.0}, u'listPrice': {u'currencyCode': u'USD', u'amountInMicros': 15920000.0}, u'finskyOfferType': 3}], u'saleability': u'FOR_SALE_AND_RENTAL', u'buyLink': u'https://play.google.com/store/books/details?id=lfHo7uMk7r4C&rdid=book-lfHo7uMk7r4C&rdot=1&source=gbs_api', u'listPrice': {u'amount': 28.95, u'currencyCode': u'USD'}}",04ESeHAE0nc,"{u'webReaderLink': u'http://play.google.com/books/reader?id=lfHo7uMk7r4C&hl=&printsec=frontcover&source=gbs_api', u'publicDomain': False, u'embeddable': True, u'country': u'US', u'textToSpeechPermission': u'ALLOWED', u'pdf': {u'isAvailable': True, u'acsTokenLink': u'http://books.google.com/books/download/TCP_IP_Sockets_in_Java-sample-pdf.acsm?id=lfHo7uMk7r4C&format=pdf&output=acs4_fulfillment_token&dl_type=sample&source=gbs_api'}, u'quoteSharingAllowed': False, u'viewability': u'PARTIAL', u'epub': {u'isAvailable': True, u'acsTokenLink': u'http://books.google.com/books/download/TCP_IP_Sockets_in_Java-sample-epub.acsm?id=lfHo7uMk7r4C&format=epub&output=acs4_fulfillment_token&dl_type=sample&source=gbs_api'}, u'accessViewStatus': u'SAMPLE'}",lfHo7uMk7r4C,https://www.googleapis.com/books/v1/volumes/lfHo7uMk7r4C
books#volume,"{u'publisher': u'""O\'Reilly Media, Inc.""', u'description': u""A guide for Java programmers explains how to use XSLT's ability to provide platform-independent data to build Web-based applications incorporating transformations as well as interactive Web site and wireless services."", u'language': u'en', u'publishedDate': u'2001', u'readingModes': {u'text': False, u'image': True}, u'previewLink': u'http://books.google.com/books?id=eSRnOKwU4hUC&printsec=frontcover&dq=java&hl=&cd=39&source=gbs_api', u'title': u'Java and XSLT', u'printType': u'BOOK', u'canonicalVolumeLink': u'https://books.google.com/books/about/Java_and_XSLT.html?hl=&id=eSRnOKwU4hUC', u'pageCount': 510, u'maturityRating': u'NOT_MATURE', u'contentVersion': u'preview-1.0.0', u'industryIdentifiers': [{u'identifier': u'0596001436', u'type': u'ISBN_10'}, {u'identifier': u'9780596001438', u'type': u'ISBN_13'}], u'imageLinks': {u'smallThumbnail': u'http://books.google.com/books/content?id=eSRnOKwU4hUC&printsec=frontcover&img=1&zoom=5&edge=curl&source=gbs_api', u'thumbnail': u'http://books.google.com/books/content?id=eSRnOKwU4hUC&printsec=frontcover&img=1&zoom=1&edge=curl&source=gbs_api'}, u'authors': [u'Eric Burke'], u'ratingsCount': 2, u'allowAnonLogging': False, u'infoLink': u'http://books.google.com/books?id=eSRnOKwU4hUC&dq=java&hl=&source=gbs_api', u'categories': [u'Computers'], u'averageRating': 4.0}",{u'textSnippet': u'A guide for Java programmers explains how to use XSLT&#39;s ability to provide platform-independent data to build Web-based applications incorporating transformations as well as interactive Web site and wireless services.'},"{u'country': u'US', u'saleability': u'NOT_FOR_SALE', u'isEbook': False}",/42EfmSigQU,"{u'webReaderLink': u'http://play.google.com/books/reader?id=eSRnOKwU4hUC&hl=&printsec=frontcover&source=gbs_api', u'publicDomain': False, u'embeddable': True, u'country': u'US', u'textToSpeechPermission': u'ALLOWED', u'pdf': {u'isAvailable': True}, u'quoteSharingAllowed': False, u'viewability': u'PARTIAL', u'epub': {u'isAvailable': False}, u'accessViewStatus': u'SAMPLE'}",eSRnOKwU4hUC,https://www.googleapis.com/books/v1/volumes/eSRnOKwU4hUC
books#volume,"{u'publisher': u'Tata McGraw-Hill Education', u'description': u""The author begins by explaining why Java is the preeminent programming language of the Internet, how it relates to object-oriented programming (OOP), and the general form of a Java program. Then it's on to data types, operators, control statements, classes, objects, and methods. Next, learn about inheritance, exception handling, the I/O system, and multithreading. More advanced topics such as generics, interfaces, applets, and enumerations are also covered. The book ends with an introduction to Swing, Java's powerful GUI toolkit. Start programming in Java today with help from this fast-paced, hands-on tutorial."", u'language': u'en', u'publishedDate': u'2007-01-01', u'readingModes': {u'text': False, u'image': False}, u'previewLink': u'http://books.google.com/books?id=Ksiry08PxkQC&dq=java&hl=&cd=64&source=gbs_api', u'title': u'Java: A Beginner S Guide', u'printType': u'BOOK', u'canonicalVolumeLink': u'https://books.google.com/books/about/Java_A_Beginner_S_Guide.html?hl=&id=Ksiry08PxkQC', u'maturityRating': u'NOT_MATURE', u'contentVersion': u'preview-1.0.0', u'industryIdentifiers': [{u'identifier': u'0070659680', u'type': u'ISBN_10'}, {u'identifier': u'9780070659681', u'type': u'ISBN_13'}], u'imageLinks': {u'smallThumbnail': u'http://books.google.com/books/content?id=Ksiry08PxkQC&printsec=frontcover&img=1&zoom=5&source=gbs_api', u'thumbnail': u'http://books.google.com/books/content?id=Ksiry08PxkQC&printsec=frontcover&img=1&zoom=1&source=gbs_api'}, u'authors': [u'Schildt'], u'ratingsCount': 2, u'allowAnonLogging': False, u'infoLink': u'http://books.google.com/books?id=Ksiry08PxkQC&dq=java&hl=&source=gbs_api', u'averageRating': 5.0}","{u'textSnippet': u'More advanced topics such as generics, interfaces, applets, and enumerations are also covered. The book ends with an introduction to Swing, Java&#39;s powerful GUI toolkit.'}","{u'country': u'US', u'saleability': u'NOT_FOR_SALE', u'isEbook': False}",FLIr5uNnPXk,"{u'webReaderLink': u'http://play.google.com/books/reader?id=Ksiry08PxkQC&hl=&printsec=frontcover&output=reader&source=gbs_api', u'publicDomain': False, u'embeddable': False, u'country': u'US', u'textToSpeechPermission': u'ALLOWED', u'pdf': {u'isAvailable': False}, u'quoteSharingAllowed': False, u'viewability': u'NO_PAGES', u'epub': {u'isAvailable': False}, u'accessViewStatus': u'NONE'}",Ksiry08PxkQC,https://www.googleapis.com/books/v1/volumes/Ksiry08PxkQC
books#volume,"{u'publisher': u'Prentice Hall', u'subtitle': u'Object-oriented Problem Solving', u'description': u'""Java, Java, Java, Third Edition systematically introduces the Java 1.5 language to the context of practical problem-solving and effective object-oriented design. Carefully and incrementally, the authors demonstrate how to decompose problems, use UML diagrams to design Java software that solves those problems, and transform their designs into efficient, robust code. Their ""objects-early"" approach reflects the latest pedagogical insights into teaching Java, and their examples help readers apply sophisticated techniques rapidly and effectively.""--BOOK JACKET.', u'language': u'en', u'publishedDate': u'2006-01', u'readingModes': {u'text': False, u'image': False}, u'previewLink': u'http://books.google.com/books?id=k_a0pVRrFVkC&q=java&dq=java&hl=&cd=65&source=gbs_api', u'title': u'Java, Java, Java', u'printType': u'BOOK', u'canonicalVolumeLink': u'https://books.google.com/books/about/Java_Java_Java.html?hl=&id=k_a0pVRrFVkC', u'pageCount': 862, u'maturityRating': u'NOT_MATURE', u'contentVersion': u'preview-1.0.0', u'industryIdentifiers': [{u'identifier': u'9780131474345', u'type': u'ISBN_13'}, {u'identifier': u'0131474340', u'type': u'ISBN_10'}], u'imageLinks': {u'smallThumbnail': u'http://books.google.com/books/content?id=k_a0pVRrFVkC&printsec=frontcover&img=1&zoom=5&source=gbs_api', u'thumbnail': u'http://books.google.com/books/content?id=k_a0pVRrFVkC&printsec=frontcover&img=1&zoom=1&source=gbs_api'}, u'authors': [u'Ralph Morelli', u'Ralph Walde'], u'ratingsCount': 2, u'allowAnonLogging': False, u'infoLink': u'http://books.google.com/books?id=k_a0pVRrFVkC&dq=java&hl=&source=gbs_api', u'categories': [u'Computers'], u'averageRating': 4.5}","{u'textSnippet': u'&quot;Java, Java, Java, Third Edition systematically introduces the Java 1.5 language to the context of practical problem-solving and effective object-oriented design.'}","{u'country': u'US', u'saleability': u'NOT_FOR_SALE', u'isEbook': False}",6oAQBHumII0,"{u'webReaderLink': u'http://play.google.com/books/reader?id=k_a0pVRrFVkC&hl=&printsec=frontcover&output=reader&source=gbs_api', u'publicDomain': False, u'embeddable': False, u'country': u'US', u'textToSpeechPermission': u'ALLOWED_FOR_ACCESSIBILITY', u'pdf': {u'isAvailable': False}, u'quoteSharingAllowed': False, u'viewability': u'NO_PAGES', u'epub': {u'isAvailable': False}, u'accessViewStatus': u'NONE'}",k_a0pVRrFVkC,https://www.googleapis.com/books/v1/volumes/k_a0pVRrFVkC
books#volume,"{u'subtitle': u'How to Program', u'description': u'The Deitels\' groundbreaking How to Program series offers unparalleled breadth and depth of object-oriented programming concepts and intermediate-level topics for further study. The Seventh Edition has been extensively fine-tuned and is completely up-to-date with Sun Microsystems, Inc.\'s latest Java release Java Standard Edition 6 (""Mustang"") and several Java Enterprise Edition 5 topics. Contains an extensive OOD/UML 2 case study on developing an automated teller machine. Takes a new tools-based approach to Web application development that uses Netbeans 5.5 and Java Studio Creator 2 to create and consume Web Services. Features new AJAX-enabled, Web applications built with JavaServer Faces (JSF), Java Studio Creator 2 and the Java Blueprints AJAX Components. Includes new topics throughout, such as JDBC 4, SwingWorker for multithreaded GUIs, GroupLayout, Java Desktop Integration Components (JDIC), and much more. A valuable reference for programmers and anyone interested in learning the Java programming language.', u'language': u'en', u'publishedDate': u'2007', u'readingModes': {u'text': False, u'image': False}, u'previewLink': u'http://books.google.com/books?id=woaCQgAACAAJ&dq=java&hl=&cd=70&source=gbs_api', u'title': u'Java', u'printType': u'BOOK', u'canonicalVolumeLink': u'https://books.google.com/books/about/Java.html?hl=&id=woaCQgAACAAJ', u'pageCount': 1596, u'maturityRating': u'NOT_MATURE', u'contentVersion': u'preview-1.0.0', u'industryIdentifiers': [{u'identifier': u'0132222205', u'type': u'ISBN_10'}, {u'identifier': u'9780132222204', u'type': u'ISBN_13'}], u'imageLinks': {u'smallThumbnail': u'http://books.google.com/books/content?id=woaCQgAACAAJ&printsec=frontcover&img=1&zoom=5&source=gbs_api', u'thumbnail': u'http://books.google.com/books/content?id=woaCQgAACAAJ&printsec=frontcover&img=1&zoom=1&source=gbs_api'}, u'authors': [u'Paul J. Deitel', u'Harvey M. Deitel'], u'ratingsCount': 2, u'allowAnonLogging': False, u'infoLink': u'http://books.google.com/books?id=woaCQgAACAAJ&dq=java&hl=&source=gbs_api', u'categories': [u'Computers'], u'averageRating': 4.5}","{u'textSnippet': u'The Seventh Edition has been extensively fine-tuned and is completely up-to-date with Sun Microsystems, Inc.&#39;s latest Java release Java Standard Edition 6 (&quot;Mustang&quot;) and several Java Enterprise Edition 5 topics.'}","{u'country': u'US', u'saleability': u'NOT_FOR_SALE', u'isEbook': False}",HflviX9aReI,"{u'webReaderLink': u'http://play.google.com/books/reader?id=woaCQgAACAAJ&hl=&printsec=frontcover&output=reader&source=gbs_api', u'publicDomain': False, u'embeddable': False, u'country': u'US', u'textToSpeechPermission': u'ALLOWED', u'pdf': {u'isAvailable': False}, u'quoteSharingAllowed': False, u'viewability': u'NO_PAGES', u'epub': {u'isAvailable': False}, u'accessViewStatus': u'NONE'}",woaCQgAACAAJ,https://www.googleapis.com/books/v1/volumes/woaCQgAACAAJ
